plot,location,elevation,hydrology,comment
050,Berger Alm,1850m,Wasser mäßig fließend, über auf gewitterter Grundmoräne
053,Großleobenalm,1800m,Wasser mäßig fließend, über phyllonitischen Schiefer und aufgewitterter Grundmoräne
045,Vogelsangbach, 2000m,Wasser mäßig fließend, über Konglomerate
043,Stangalm, 2050 m,Wasser mäßig fließend, über Konglomerate
028,Falkertsee,1950 m,Wasser mäßig fließend, über phyllonitischen Schiefern
030,Rosental,1500m,Wasser mäßig fließend, über Schieferblöcken
054,Großleobenbach,1300m,,Moose auf Gesteinsblöcken und Sand entlang des Baches
038,Südhang des Peitlernock,1900m,Wasser mäßig fließend, über Glimmerschiefer